,Company,date,time,headline,Sentiment
0,AMD,Nov-25-20,08:52PM,"Dow Jones Futures: Nasdaq Hits High As AMD, Shopify, PayPal Signal Buys, But This Should Worry You",1
1,AMD,Nov-25-20,08:37PM,Is AMD Stock a Buy Right Now? This Is What You Need to Know,1
2,AMD,Nov-25-20,01:12PM,Are the Insiders Buying the Semiconductor Stocks?,1
3,AMD,Nov-25-20,01:08PM,Are the Insiders Buying the Semiconductor Stocks?,1
4,AMD,Nov-25-20,12:58PM,Understanding Advanced Micro Devices's Unusual Options Activity,0
5,AMD,Nov-24-20,12:03PM,"Dow Jones Jumps 500 Points, As Trump Agrees To Biden Transition; Nio, Tesla Race To Record Highs",1
6,AMD,Nov-23-20,04:14PM,Chipmaker AMD Nears Buy Point After Getting Bullish Analyst Report,1
7,AMD,Nov-23-20,02:34PM,Micron Technology Stock Gains. Analysts See Rebound for Chips.,1
8,AMD,Nov-23-20,12:46PM,M&A Is Back. These Industries Are Ready for More Deals.,1
9,AMD,Nov-23-20,12:01PM,"Dow Jones Jumps 300 Points On Vaccine News, But Apple Slides; Tesla Surges To Record High, While Nio Races Higher",1
10,AMD,Nov-23-20,10:38AM,Unusual Options Activity Insight: Advanced Micro Devices,0
11,AMD,Nov-23-20,09:00AM,Are The Best Mutual Funds Buying Your Watchlist Stocks? Here's How To Find Out,1
12,AMD,Nov-22-20,07:30AM,Forget Bitcoin! Buy These 3 Tech Stocks Instead,1
13,AMD,Nov-21-20,08:00AM,"AMD, Twilio, Novocure Among 5 Stocks Flashing Multiple Buy Signals",1
14,AMD,Nov-20-20,11:53AM,"Dow Jones Falls Amid New Coronavirus Restrictions, Covid-19 Vaccine News; Nio, Tesla Eye Record Highs",1
15,AMD,Nov-20-20,08:22AM,Dow Jones Futures Cut Losses As Coronavirus Vaccine Push Offsets Covid Restrictions,1
16,AMD,Nov-20-20,08:02AM,"Mysterious Mnuchin, Vaccines at the Ready, Carnival Isn't Cruising, 2 Big 'W's",1
17,AMD,Nov-19-20,06:02PM,"Dow Jones Futures: AMD, Twilio Flash Early Entries, Tesla, Nio Keep Rising In Stock Market Rally; Workday Earnings Top",1
18,AMD,Nov-19-20,04:53PM,Stock Market Today: Flicker of Stimulus Hope Lifts Stocks,1
19,AMD,Nov-19-20,04:01PM,Black Friday 2020: Tips for buying the best tech gifts,1
20,AMD,Nov-19-20,09:45AM,Advanced Micro Devices Nears Entry,0
21,AMD,Nov-19-20,08:14AM,"Dow Jones Futures: Coronavirus News Hits Stock Market Rally, But Tesla Breaks Out; Nvidia Earnings Strong",1
22,AMD,Nov-19-20,07:00AM,Innovation Is Crucial for Chip Companies. Heres Whos Spending the Most on Their Research,1
23,AMD,Nov-18-20,02:27PM,How Does Bitcoin Mining Work?,1
24,AMD,Nov-18-20,12:43PM,Microsoft (MSFT) Announces Pluton Processor: Key Takeaways,1
25,AMD,Nov-18-20,09:52AM,"The Zacks Analyst Blog Highlights: Philip Morris, Lockheed Martin, Advanced Micro Devices, Boeing and General Electric",1
26,AMD,Nov-18-20,08:15AM,3 Growth Stocks to Buy as Video Gaming Takes Off Big Time,1
27,AMD,Nov-17-20,02:22PM,"Top Stock Reports for Philip Morris, Lockheed Martin & AMD",1
28,AMD,Nov-17-20,10:45AM,AMD's New Instinct MI100 Accelerator to Boost HPC Workloads,1
29,AMD,Nov-17-20,09:14AM,Top 10 Stocks New Mets Owner Steve Cohen Was Buying in Q3,1
30,AMD,Nov-17-20,09:00AM,Microsoft Teams Up With Chipmakers to Boost PC Security,1
31,AMD,Nov-17-20,06:30AM,"Intel May Be Down, But It's Far From Being Out",1
32,AMD,Nov-16-20,08:02PM,Samsung Intensifies Chip Wars With Bet It Can Catch TSMC by 2022,1
33,AMD,Nov-16-20,04:15PM,AMD to Present at Credit Suisse 24th Annual Technology Conference,1
34,AMD,Nov-16-20,10:29AM,Microsoft (MSFT) Detects Cyberattacks on COVID-19 Studies,1
35,AMD,Nov-16-20,09:45AM,NVIDIA Looks to Erase a Key AMD Advantage,1
36,AMD,Nov-16-20,09:00AM,AMD EPYC Processors and New AMD Instinct MI100 Accelerator Redefine Performance for HPC and Scientific Research,1
37,AMD,Nov-16-20,09:00AM,AMD Announces Worlds Fastest HPC Accelerator for Scientific Research¹,1
38,AMD,Nov-16-20,07:45AM,Is AMD Stock A Buy Right Now? Here's What IBD Charts Show,1
39,AMD,Nov-16-20,07:30AM,Is Intel Stock A Buy Right Now? Here's What IBD Charts Show,1
40,AMD,Nov-15-20,12:01PM,PlayStation 5 versus Xbox Series X: Which new console should you buy?,1
41,AMD,Nov-13-20,08:00PM,Mergers Have Bounced Back. But Will Biden See an M&A Boom?,1
42,AMD,Nov-13-20,08:30AM,AMD Is Shattering Intel's Dominance in Style,1
43,AMD,Nov-13-20,07:25AM,"Cramer Gives His Opinion On Blackstone, Advanced Micro Devices And More",0
44,AMD,Nov-12-20,12:30PM,"Forget AMD, This Hot Gaming Stock Has Almost Doubled and Could Still Win Big",1
45,AMD,Nov-12-20,09:10AM,IBM Teams Up With AMD to Enhance AI and Security Solutions,1
46,AMD,Nov-11-20,03:56PM,"Apple is taking control, and a risky bet, with its M1 chip",1
47,AMD,Nov-11-20,11:39AM,"Dow Jones Rallies 150 Points, As Tech Stocks Snap Back; Apple, Tesla Rebound, But Datadog Plunges On Earnings",1
48,AMD,Nov-11-20,10:20AM,"Model N (MODN) Q4 Earnings Beat, Stock Down on Bleak View",1
49,AMD,Nov-11-20,09:48AM,2 Growth Stocks I'd Buy Right Now,1
50,AMD,Nov-11-20,08:40AM,IBM and AMD Begin Cooperation on Cybersecurity and AI,1
51,AMD,Nov-11-20,08:09AM,"Dow Jones Futures Rise 200 Points, While Tech Futures Jump As Stock Market Rotation Continues; 6 Tech Giants Sell Off",1
52,AMD,Nov-11-20,07:30AM,"IBM and AMD will work together on security, artificial intelligence",1
53,AMD,Nov-11-20,07:00AM,IBM and AMD Announce Joint Development Agreement to Advance Confidential Computing for the Cloud and Accelerate Artificial Intelligence,1
54,AMD,Nov-10-20,02:47PM,"Apple announces its first-ever M1 processor, coming to MacBooks and Macs",1
55,AMD,Nov-10-20,02:26PM,"Why Shares of Zoom, Pinterest, and Advanced Micro Devices Fell Today",0
56,AMD,Nov-10-20,12:39PM,What To Make Of An Irrational Stock Market,0
57,AMD,Nov-10-20,12:05PM,"Dow Jones Jumps 275 Points, But Tech Sell-Off Continues; Beyond Meat Plunges 24% On Earnings",1
58,AMD,Nov-10-20,09:00AM,AMD Unveils AMD Ryzen Embedded V2000 Processors with Enhanced Performance and Power Efficiency,1
59,AMD,Nov-09-20,04:28PM,Apple 'One More Thing' Mac event: What to expect,1
60,AMD,Nov-09-20,04:00PM,Marvell Stock Shows Rising Price Performance With Jump To 93 RS Rating,1
61,AMD,Nov-09-20,12:52PM,"Top Stock Reports for NVIDIA, Netflix & Starbucks",1
62,AMD,Nov-09-20,12:15PM,Q3 Solid Earnings Push Semiconductor ETFs to New Highs,1
63,AMD,Nov-09-20,10:55AM,"Silicon Laboratories Shows Rising Relative Strength, Gets A Stock Upgrade",1
64,AMD,Nov-09-20,10:38AM,Advanced Micro Devices Holds Support,0
65,AMD,Nov-07-20,09:30AM,The Reviews Are in: AMD Is the New Gaming CPU King,1
66,AMD,Nov-07-20,08:00AM,Nvidia Breaks Out After Early Entry; Microsoft Leads Tech Giants Offering Multiple Buy Points,1
67,AMD,Nov-06-20,03:38PM,AMD Stock Is Higher on Another Upgrade to Buy,1
68,AMD,Nov-06-20,01:47PM,AMD Shares Rise on Wells Fargo Upgrade to Overweight,1
69,AMD,Nov-06-20,12:01PM,AMD stock gains after Wells Fargo upgrade,1
70,AMD,Nov-06-20,11:58AM,Nvidia May Need to Get Worse Before it Gets Better,1
71,AMD,Nov-06-20,11:00AM,Qualcomm Shows Market Leadership With Jump To 93 RS Rating,1
72,AMD,Nov-06-20,09:25AM,"Realogy Holdings, Hawaiian Holdings, Intel, NVIDIA and Advanced Micro Devices highlighted as Zacks Bull and Bear of the Day",1
73,AMD,Nov-05-20,10:41AM,Intel (INTC) Spruces Up AI Capabilities to Challenge AMD & NVDA,1
74,AMD,Nov-05-20,09:00AM,Microsoft Xbox Series X Review: Tons of power and potential at a price,1
75,AMD,Nov-04-20,05:26PM,Why AMD Stock Popped Today,1
76,AMD,Nov-04-20,04:30PM,"Nasdaq, S&P Have Best Day After Election Performance on Record",1
77,AMD,Nov-04-20,11:57AM,"Dow Jones Surges 600 Points, While Tech Stocks Soar; Trump Claims Big Win, But Election Results Unclear",1
78,AMD,Nov-04-20,10:43AM,"Goldman's Semiconductor Pair Trade: Buy AMD, Sell Intel",1
79,AMD,Nov-04-20,10:26AM,"China, Semiconductor Industry Await Outcome Of U.S. Presidential Election",1
80,AMD,Nov-04-20,10:26AM,"Benzinga's Top Upgrades, Downgrades For November 4, 2020",1
81,AMD,Nov-04-20,10:00AM,"Dow Jones Today, Stocks Soar; Biden Vs. Trump Down To The Wire; AMD Gets Goldman Upgrade",1
82,AMD,Nov-04-20,09:57AM,AMD Higher as Goldman Upgrades to Buy on Valuation,1
83,AMD,Nov-03-20,05:49PM,"XILINX INVESTOR ALERT by the Former Attorney General of Louisiana: Kahn Swick & Foti, LLC Investigates Adequacy of Price and Process in Proposed Sale of Xilinx, Inc. - XLNX",1
84,AMD,Nov-03-20,12:45PM,Is AMD About to Bury NVIDIA With Its Latest RX 6000 Graphics Cards?,1
85,AMD,Nov-02-20,01:59PM,"Dow Jones Surges as Intel Stock Upgraded, Apple Warns About App Store Fees",1
86,AMD,Nov-02-20,12:04PM,"ALERT: Halper Sadeh LLP Reminds Shareholders About Its Ongoing Merger Investigations; Investors are Encouraged to Contact the Firm -- WPX, GLIBA, AMD, DNKN",1
87,AMD,Nov-02-20,09:54AM,This Top Growth Stock Could Double Once Again,1
88,AMD,Nov-02-20,08:30AM,AMD May Finally Dethrone NVIDIA,1
89,AMD,Nov-02-20,08:15AM,Is Now the Time to Buy These 3 Beaten Down Stocks of the Dow Jones Industrial Average?,1
90,AMD,Oct-30-20,07:28PM,"After Taking Intel Out, Is AMD About to Dethrone Nvidia? Analyst Weighs In",1
91,AMD,Oct-30-20,06:10PM,AMD Has Big Ambitions. Why Thats Becoming a Risk for the Stock.,1
92,AMD,Oct-30-20,04:28PM,"Stock Market Rally Dives On Coronavirus Fears, Apple, Microsoft, Facebook, Amazon Earnings: Weekly Review",0
93,AMD,Oct-30-20,03:30PM,"Lifshitz Law Firm, P.C. Announces Investigation of Perceptron, Inc., Standard AVB Financial Corp., Virtusa Corporation and Xilinx, Inc.",1
94,AMD,Oct-30-20,12:41PM,The Great Chip Consolidation: Who's Next?,1
95,AMD,Oct-30-20,12:15PM,ETFs to Gain as Marvell's Inphi Buyout Creates $40B Giant,1
96,AMD,Oct-30-20,10:25AM,"Zacks Value Trader Highlights: Advanced Micro Devices, NVIDIA, Wingstop, Domino's Pizza and Chipotle Mexican Grill",1
97,AMD,Oct-29-20,03:22PM,Could A Cash-Secured Put In IBD 50 Member AMD Produce A $600 Profit In 5-1/2 Months?,1
98,AMD,Oct-29-20,02:55PM,"SHAREHOLDER ALERT: Monteverde & Associates PC Announces an Investigation of Advanced Micro Devices, Inc. - AMD",1
99,AMD,Oct-29-20,12:39PM,What Stocks Should be on Your Wish List?,1
100,MSFT,Nov-25-20,07:11PM,5 Thoughts on Salesforce's Reported Interest in Acquiring Slack,1
101,MSFT,Nov-25-20,06:09PM,These 2 IPO Stocks Are Crushing the Stock Market on Wednesday,1
102,MSFT,Nov-25-20,05:52PM,3 Blue Chip Stocks to Buy Heading into 2021,1
103,MSFT,Nov-25-20,04:58PM,"Dow Jones Futures: Nasdaq Hits High As AMD, Shopify, PayPal Signal Buys, But Watch Out For This",1
104,MSFT,Nov-25-20,04:25PM,Slack Stock Soars On Salesforce Merger Talks As Microsoft Looms,1
105,MSFT,Nov-25-20,03:28PM,Salesforce Is Said to Explore Acquisition of Slack,1
106,MSFT,Nov-25-20,02:50PM,"Amazon Cloud Outage Hits Customers Including Roku, Adobe",1
107,MSFT,Nov-25-20,01:55PM,Slack Shares Soar on Report of Salesforce Deal Talks. An M&A Wave Awaits Software.,1
108,MSFT,Nov-25-20,01:26PM,Why Salesforce reportedly making a huge play for Slack isn't a shock,1
109,MSFT,Nov-25-20,01:19PM,"Salesforce acquisition of Slack could trigger M&A wave, analyst says",1
110,MSFT,Nov-25-20,01:14PM,"Dow Jones Sinks Below 30,000; IBM to Cut Jobs; Salesforce Could Buy Slack",1
111,MSFT,Nov-25-20,12:26PM,Amazon Web Services suffers amid widespread issues with online applications,1
112,MSFT,Nov-25-20,11:34AM,How much people are expected to spend this Cyber Monday,1
113,MSFT,Nov-25-20,11:30AM,2 Reasons Why It Isn't Too Late to Buy This Growth Stock,1
114,MSFT,Nov-25-20,10:45AM,Better Buy: Alibaba vs. Amazon,1
115,MSFT,Nov-25-20,10:10AM,"Dow Tops 30,000: 5 Stocks Driving the ETF",1
116,MSFT,Nov-25-20,10:02AM,"Dow Jones Today Dips, Nasdaq Climbs As Jobless Claims Jump; Nikola Worries, China Investigation Hammers E-Auto Stocks",1
117,MSFT,Nov-25-20,09:21AM,HP CEO: COVID-19 pandemic has reinforced our consumer business,1
118,MSFT,Nov-25-20,09:17AM,"Autodesk (ADSK) Q3 Earnings Top Estimates, Revenues Rise Y/Y",1
119,MSFT,Nov-25-20,09:00AM,2 Top Stocks You Can Buy On Sale,1
120,MSFT,Nov-25-20,07:30AM,Hedge Funds Are Finally Beating the Market in 2020. Here Are Their Top Holdings.,1
121,MSFT,Nov-25-20,04:18AM,Nintendo Adds Sharp as Assembler of Popular Switch Game Console,1
122,MSFT,Nov-24-20,06:25PM,"Dow Closes Above 30,000 at a New Record High",1
123,MSFT,Nov-24-20,05:45PM,Elon Musk becomes world's second richest person,1
124,MSFT,Nov-24-20,04:27PM,Dell Reports Revenue That Tops Estimates on Robust PC Demand,1
125,MSFT,Nov-24-20,02:45PM,"Dow Jones Tops 30,000; Microsoft and Boeing Stocks Surge",1
126,MSFT,Nov-24-20,02:08PM,"Dow Tops 30,000 For First Time Ever",1
127,MSFT,Nov-24-20,01:13PM,Do Hedge Funds Still Love Microsoft Corporation (MSFT)?,1
128,MSFT,Nov-24-20,10:22AM,Microsoft (MSFT) Eyes Bigger Share as Console Wars Heat Up,1
129,MSFT,Nov-24-20,09:53AM,Citrix (CTXS) Virtual Desktops Leveraged by Royal Berkshire NHS,1
130,MSFT,Nov-24-20,09:51AM,"Benzinga's Top Upgrades, Downgrades For November 24, 2020",1
131,MSFT,Nov-24-20,09:46AM,Enterprise Communication Boom to Drive These 4 Stocks Beyond 2020,1
132,MSFT,Nov-24-20,08:30AM,Best Tech Stocks To Buy Or Watch Now: 5 Growth Stocks Leading The Stock Market,1
133,MSFT,Nov-24-20,08:16AM,Microsoft (MSFT) Reveals Flurry of Xbox Black Friday Deals,1
134,MSFT,Nov-24-20,07:34AM,These 3 Stocks Got Even Stronger During the COVID-19 Pandemic,1
135,MSFT,Nov-24-20,06:30AM,Microsoft's Cloud Growth Continues to Pay Dividends,1
136,MSFT,Nov-24-20,06:00AM,Why It Isnt Ludicrous to Think of Honeywell as the Tesla of Big Industrial Stocks,1
137,MSFT,Nov-24-20,05:51AM,4 Robinhood Stocks Billionaires Bought in Q3,1
138,MSFT,Nov-24-20,04:17AM,What the Vaccine News Means for Airline Stocks,1
139,MSFT,Nov-24-20,02:07AM,Suited avatars and digital offices: traders and bankers embrace VR,1
140,MSFT,Nov-24-20,02:00AM,INSIGHT-Suited avatars and digital offices: traders and bankers embrace VR,1
141,MSFT,Nov-23-20,04:39PM,AvePoint Strikes Deal to Go Public Via Apex Technology SPAC,1
142,MSFT,Nov-23-20,02:34PM,Micron Technology Stock Gains. Analysts See Rebound for Chips.,1
143,MSFT,Nov-23-20,02:28PM,Gift Guide: Which next-gen console is the one your kid wants?,1
144,MSFT,Nov-23-20,02:14PM,Why Micron Stock Gained Today,1
145,MSFT,Nov-23-20,12:45PM,The Best Reason to Own Zoom Stock,1
146,MSFT,Nov-23-20,11:15AM,AvePoint CEO on why the company is going public via SPAC,1
147,MSFT,Nov-23-20,11:11AM,Microsoft Cloud Provider AvePoint Going Public Via Apex Technology SPAC,1
148,MSFT,Nov-23-20,11:04AM,"Dow Rallies as Investors Cheer Possible Return of Yellen, Vaccine News",1
149,MSFT,Nov-23-20,10:17AM,Dow Rallies on News Biden to Pick Yellen as Treasury Secretary,1
150,MSFT,Nov-23-20,09:57AM,Microsoft cloud partner AvePoint going public via merger with blank-check company Apex Technology,1
151,MSFT,Nov-23-20,08:19AM,Google Ad Changes Targeted by Rivals in U.K. Complaint,1
152,MSFT,Nov-23-20,08:11AM,Dow Jones Futures Rise On Latest Coronavirus News; Qualcomm Near Buy Point In Stock Market Rally; Apple Looks Tired,1
153,MSFT,Nov-23-20,07:24AM,Moody's:  US companies cash holdings hit record high amid pandemic,1
154,MSFT,Nov-23-20,07:00AM,Foxconn Plant Championed by Trump Lands Google Server Contract,1
155,MSFT,Nov-23-20,12:27AM,"Apple, Microsoft Work Together To Bring Xbox Series X Controller Support For iPhone, iPad",1
156,MSFT,Nov-22-20,05:22PM,Stock Market Rally: Qualcomm Near Buy Point; Apple Looks Tired As Dow Futures Loom,1
157,MSFT,Nov-22-20,09:25AM,Avoid this Trendy Stock No Matter What,1
158,MSFT,Nov-22-20,07:30AM,Forget Bitcoin! Buy These 3 Tech Stocks Instead,1
159,MSFT,Nov-22-20,07:02AM,Experts Debate: What Stock (Besides Amazon) Is Most Representative of the U.S. Stock Market?,0
160,MSFT,Nov-21-20,09:15AM,Buy These 3 E-Commerce Stocks Before Another Market Dip,1
161,MSFT,Nov-21-20,06:45AM,Microsoft's Growth Engine is Firing on All Cylinders,1
162,MSFT,Nov-20-20,08:57PM,Investors Are Gorging on Hyper-Bullishness as Turkey Day Nears,1
163,MSFT,Nov-20-20,08:30PM,Retail Investors Pour Money Into China Funds,1
164,MSFT,Nov-20-20,06:39PM,Virtual Reality Is Making Progress. What That Means for Facebook and Oculus.,1
165,MSFT,Nov-20-20,06:05PM,Apple to AT&T Wary of Full Disclosure in Google Antitrust Case,1
166,MSFT,Nov-20-20,04:47PM,U.S. Equity Markets Continue to Fall as COVID-19 Cases Rise,1
167,MSFT,Nov-20-20,02:28PM,"Dow Jones Lower as Disney Mulls Skipping Theaters, Microsoft Makes Teams Video Calls Free for Now",1
168,MSFT,Nov-20-20,02:08PM,"With Coronavirus Cases Climbing, Consider Slack a Buy",1
169,MSFT,Nov-20-20,01:09PM,Microsoft Adds New Free Features for Teams as It Battles Zoom,1
170,MSFT,Nov-20-20,10:37AM,"The stock market is advancing without help from the FAAMNGs, which analysts say is a bullish sign",1
171,MSFT,Nov-20-20,10:07AM,ServiceNow (NOW) Adds New Capabilities to Facebook's Workplace,1
172,MSFT,Nov-20-20,09:13AM,Video Game Stocks in Play This Home Holiday Season,1
173,MSFT,Nov-20-20,09:11AM,Better Buy: QQQ vs. VOO,1
174,MSFT,Nov-20-20,09:06AM,Gaming Platform Roblox Files for IPO,1
175,MSFT,Nov-20-20,08:56AM,"The Zacks Analyst Blog Highlights: Google, Microsoft, Texas Instruments, NVIDIA and Skyworks Solutions",1
176,MSFT,Nov-20-20,06:00AM,What Teladoc and Livongo Health's Explosive Results Mean For Success Post-Merger,1
177,MSFT,Nov-19-20,06:34PM,Telos Shares Surge in Trading Debut as IPOs Return,1
178,MSFT,Nov-19-20,04:01PM,Black Friday 2020: Tips for buying the best tech gifts,1
179,MSFT,Nov-19-20,03:18PM,Dow Jones Rallies On Schumer Coronavirus Stimulus Comments; Software Stocks Lead,1
180,MSFT,Nov-19-20,03:00PM,Microsoft Vows to Challenge Government Requests For User Data,1
181,MSFT,Nov-19-20,12:00PM,Microsoft brings new shopping tools to its Edge browser,1
182,MSFT,Nov-19-20,10:47AM,"Dow Cuts Losses on Tech Strength, Stimulus Hopes",1
183,MSFT,Nov-19-20,10:16AM,"Facebook, Apple and Other Big Tech Stocks Arent Too Expensive. Heres Why.",1
184,MSFT,Nov-19-20,09:45AM,Better Buy: Baidu vs. Alphabet,1
185,MSFT,Nov-19-20,08:09AM,3 Great Stocks You Can Buy and Hold Forever,1
186,MSFT,Nov-19-20,07:45AM,3 ETFs Perfect for Robinhood Investors,1
187,MSFT,Nov-19-20,07:41AM,5 Tech Giants to Buy at Deep Discount Amid Recent Turmoil,1
188,MSFT,Nov-19-20,04:32AM,"Sony, Microsoft Consoles Struggle With Thin Launch-Day Stock",1
189,MSFT,Nov-19-20,12:04AM,"Microsoft, Sony's Big Woe With PlayStation 5, New Xbox Series: High Demand, Very Low Supply",1
190,MSFT,Nov-18-20,08:01PM,"UNICEF calls for averting a lost generation as COVID-19 threatens to cause irreversible harm to children's education, nutrition and well-being",1
191,MSFT,Nov-18-20,03:12PM,StockX expands authentication footprint by 50% amid COVID-19,1
192,MSFT,Nov-18-20,12:43PM,Microsoft (MSFT) Announces Pluton Processor: Key Takeaways,1
193,MSFT,Nov-18-20,12:21PM,Trump Extends Post-Election Purge With Firing of Cyber Official,1
194,MSFT,Nov-18-20,12:00PM,Why the PlayStation 5 Release Won't Move the Needle for Sony's Stock,1
195,MSFT,Nov-18-20,10:30AM,Big Tech Backlash Means Get Ready for Less Free Stuff,1
196,MSFT,Nov-18-20,10:11AM,"Investing Strategies: Horizon Therapeutics CEO, Chegg CFO, O'Neil Investment Strategist Share Insights",1
197,MSFT,Nov-18-20,08:15AM,3 Growth Stocks to Buy as Video Gaming Takes Off Big Time,1
198,MSFT,Nov-18-20,08:08AM,"Dow Jones Futures Rally 150 Points On Pfizer Coronavirus Vaccine News; Tesla Races Higher On Upgrade, While Nio Jumps On Earnings",1
199,MSFT,Nov-18-20,08:00AM,How To Invest In Growth Stocks And The Lesson Of Microsoft: When To Use The 8-Week Hold Rule,1
200,LMND,Nov-24-20,08:31AM,Insurer Metromile Will Go Public Using a Blank-Check Company,1
201,LMND,Nov-19-20,08:00AM,The AgTech Revolution is Underway in Appalachia with AppHarvest,1
202,LMND,Nov-11-20,01:04PM,Lemonade Stock Falls Even as Results Beat Expectations,1
203,LMND,Nov-11-20,09:19AM,"Lemonade Beats 3Q Estimates, Issues Strong Forecast",1
204,LMND,Nov-10-20,05:35PM,Lemonade Announces Third Quarter 2020 Financial Results,1
205,LMND,Nov-06-20,10:50AM,Lemonade to Present at Morgan Stanley Virtual Life After Covid Thematic Conference,1
206,LMND,Nov-02-20,11:07AM,Should You Be Tempted To Sell Lemonade (LMND) Stock,1
207,LMND,Oct-30-20,12:01PM,Root Insurance IPO Poised to Disrupt the Insurance Market,1
208,LMND,Oct-28-20,04:25PM,Root IPO Raises $724 Million For High-Tech Auto Insurance Provider,1
209,LMND,Oct-28-20,04:20PM,Auto-Insurance Disrupter Root Jumps 9% in Market Debut Before Closing Flat,1
210,LMND,Oct-23-20,09:00AM,Lemonade To Announce Third Quarter 2020 Financial Results,1
211,LMND,Oct-20-20,11:46AM,Insuretech Root Is Set to Go Public Next Week,1
212,LMND,Oct-18-20,11:34PM,US Leads Global IPO Boom,1
213,LMND,Oct-16-20,07:10AM,"Lemonade Falls 8% As Credit Suisse, Goldman Sachs Say Sell",0
214,LMND,Oct-12-20,03:20PM,"Its a Hot IPO Market. Now Roblox Is Going Public, Too.",1
215,LMND,Oct-09-20,04:46PM,7 Macro Trends Creating the Next Wave of Growth Stocks,1
216,LMND,Oct-08-20,10:44AM,"Clearwater Analytics Prepares for an IPO as It Looks to Sell a Minority Stake, Sources Say",1
217,LMND,Oct-06-20,07:00AM,"McAfee, Ant Group on Tap to Go Public as IPO Market Awaits Presidential Election",1
218,LMND,Oct-02-20,11:30AM,"Here's What Lemonade, Inc.'s (NYSE:LMND) Shareholder Ownership Structure Looks Like",1
219,LMND,Sep-29-20,08:00AM,Lemonade Announces Early Lock-up Expiration Extension,1
220,LMND,Sep-21-20,04:15PM,Buy Lemonade Stock Long-Term But Beware Near-Term Bumps,1
221,LMND,Sep-18-20,10:42AM,The Investors Guide to Lemonade Stock,1
222,LMND,Sep-17-20,04:07PM,Insurance Technology Is Hot. Zywave Is Selling for Up to $900M in Latest Deal.,1
223,LMND,Sep-16-20,02:40PM,Lemonade CFO Tim Bixby to Present at the Barclays Global Financial Services Conference,1
224,LMND,Sep-15-20,09:28AM,Lemonade Enters France To Further Expand in European Market,1
225,LMND,Sep-15-20,04:00AM,France is Next For Lemonades European Expansion,1
226,LMND,Sep-11-20,10:57AM,Why Long-Term Investors Should Buy Lemonade Stock on Weakness,1
227,LMND,Sep-02-20,04:22PM,"Lemonade Stock Is Attractive, but Valuation Remains a Question Mark",1
228,LMND,Aug-19-20,08:01PM,Airbnb files for IPO that was hard to imagine just a few months ago,1
229,LMND,Aug-16-20,01:07PM,"Kiplinger's Weekly Earnings Calendar (8/17-8/21): HD, NVDA, TGT",1
230,LMND,Aug-14-20,05:00PM,Duck Creek Stock Soars After IPO. What to Know About the Insurtech.,1
231,LMND,Aug-14-20,12:29PM,Lemonade Stock Is In for Turbulence. Buy Only If LMND Slides 30%,1
232,LMND,Aug-14-20,09:28AM,IPOs Keep Blasting Past Pricing Expectations,1
233,LMND,Aug-13-20,04:14PM,Roper Technologies Is Buying an Insurtech for More Than $5 Billion. Heres Why.,1
234,LMND,Aug-12-20,02:58AM,Lemonade Drops 5% On First Earnings Report As Guidance Falls Short,1
235,LMND,Aug-11-20,06:29PM,Lemonade stock declines following first public quarterly results,1
236,LMND,Aug-11-20,05:35PM,Lemonade Announces Second Quarter 2020 Financial Results,1
237,LMND,Aug-11-20,01:21PM,Airbnb to file for IPO this month: report,1
238,LMND,Aug-11-20,06:40AM,SoftBank Moves Into Asset Management After Return to Profits,1
239,LMND,Aug-09-20,05:37PM,"Retail sales, Lyft earnings: What to know in the week ahead",1
240,LMND,Aug-08-20,12:16PM,Thoma Bravo Raises Offer for Insurtech Majesco to $729 Million. Heres Why.,1
241,LMND,Aug-06-20,06:07PM,Sons SoftBank Poised to Return to Profit After Big Losses,1
242,LMND,Aug-06-20,10:38AM,"Lemonades 2020 Giveback Hits New High, Backing 34 Nonprofits Chosen By Customers",1
243,LMND,Aug-03-20,01:24PM,GoodRx May Be Looking to Go Public. What You Need to Know.,1
244,LMND,Jul-29-20,10:03AM,Lemonade To Announce Second Quarter 2020 Financial Results,1
245,LMND,Jul-28-20,05:14PM,"IPOs NCino, Lemonade and ZoomInfo Are Hot. Heres How IPOs Came Back From Covid-19.",1
246,LMND,Jul-27-20,02:54PM,IPO market braces for another 7 deals this week and yet another blank-check company,1
247,LMND,Jul-27-20,12:54PM,Lemonade stock falls 7.6% as Goldman initiates coverage with a sell rating,0
248,LMND,Jul-21-20,06:00AM,Lemonade Competitor Hippo Raises Capital at $1.5 Billion Value,1
249,LMND,Jul-20-20,12:00AM,SoftBank-Backed Fintech Startup Seeks $3.5 Billion Value in IPO,1
250,LMND,Jul-15-20,10:42AM,CommerceHub Said to Hire Adviser for IPO at $2 Billion-Plus Valuation,1
251,LMND,Jul-15-20,07:01AM,Lemonade Launches Health Insurance for Cats and Dogs,1
252,LMND,Jul-14-20,02:58PM,"Another Cloud IPO Has a Triple-Digit Debut, But Beware",1
253,LMND,Jul-09-20,01:22PM,Why Lemonade's Tech Disruptor Story Does Not Add Up,1
254,LMND,Jul-08-20,02:57PM,Walmart is seeking licensed Medicare agents for a new health insurance company,1
255,LMND,Jul-07-20,11:50AM,"Lemonade: A Sweet IPO, but a Sour Outlook",1
256,LMND,Jul-07-20,03:49AM,SoftBank Hits 20-Year High With $68 Billion Climb Out of Nadir,1
257,LMND,Jul-06-20,01:42PM,Lemonades CFO Says Its Digitizing the Insurance Industry. Its IPO Is a Big Winner.,1
258,LMND,Jul-06-20,11:31AM,Lemonade stock squeezes out a second day of huge post-IPO gains,1
259,LMND,Jul-05-20,05:34PM,Lemonade Gains 139% on IPO Listing Date,1
260,LMND,Jul-05-20,12:00AM,Insurance experts put premium on start-ups reaching the big time,1
261,LMND,Jul-03-20,04:39AM,SoftBank Stock Bounces to 2020 Peak as Buyers Look Beyond WeWork,1
262,LMND,Jul-03-20,02:37AM,SoftBank's Latest Unicorn IPO Is Just Delightful,1
263,LMND,Jul-02-20,06:40PM,Lemonade logs best U.S. IPO debut of 2020 with more than 140% gain,1
264,LMND,Jul-02-20,05:24PM,"Jobs Report Boosts Stocks, Tesla Soars",1
265,LMND,Jul-02-20,02:02PM,Insurance co. Lemonade surges over 100% in trading debut,1
266,LMND,Jul-02-20,12:38PM,Lemonade IPO: 5 things to know about the online insurer,1
267,LMND,Jul-02-20,12:11PM,Insurtech Lemonade Stock More Than Doubles on First Day of Trading,1
268,LMND,Jul-02-20,12:07PM,Lemonade stock more than doubles following IPO,1
